{
  "$schema": "../../schemas/workflow-deployment.schema.json",
  "schema_version": "1.1.0",
  "deployment_id": "local-deepseek-dev",
  "runtime_dir": "/home/your-user/.local/share/agent-workflow-factory/readonly-intent-review",
  "dsh_home": "/home/your-user/.local/share/agent-workflow-factory/readonly-intent-review/harness-home-v122",
  "harness_profile": "sdk-minimal",
  "patches": ["../../adapters/deepseek-harness/readonly.patch.yml"],
  "artifact_trust": {
    "trust_store": "/home/your-user/.config/agent-workflow-factory/trusted-publishers.json",
    "trust_store_signature": "/home/your-user/.config/agent-workflow-factory/trusted-publishers.sig.json",
    "trust_root_public_key": "/home/your-user/.config/agent-workflow-factory/root-public-key.json",
    "binding_manifest": "../../adapters/deepseek-harness/readonly-tool-bindings.json",
    "binding_signature": "../../adapters/deepseek-harness/readonly-tool-bindings.sig.json"
  },
  "build_signer": {
    "kind": "pem",
    "private_key_path": "/home/your-user/.config/agent-workflow-factory/build-signing-key.pem"
  },
  "runtime_signer": {
    "kind": "pem",
    "private_key_path": "/home/your-user/.config/agent-workflow-factory/runtime-signing-key.pem"
  },
  "api_key_env": "DEEPSEEK_API_KEY"
}
